{
  "intent_status": "NEEDS_CLARIFICATION",
  "rejection_code": null,
  "mode": null,
  "intended_operation": null,
  "planned_actions": [],
  "parcel_input_reference": {"kind": "none", "value": null},
  "clarification_questions": [
    "Is this a goal-directed check for Cow-Calf/Sheep, or a discovery comparison of both?"
  ],
  "parser_provenance": {
    "provider": "FIXTURE",
    "model_id": "fixture",
    "prompt_version": "RANGEMATCH_INTENT_PARSER@0.1.0",
    "generated_at": "2026-08-08T12:00:00Z",
    "provider_status": "FIXTURE",
    "ui_overrides_applied": false
  },
  "prohibited_inferences_applied": true
}
